{
  "schema_version": "secure-bench-phase7-result-v1",
  "run_id": "secure-engine-0-1-3-orthogonal-holdout-once",
  "holdout_id": "phase-5-orthogonal-holdout-v2",
  "taxonomy_version": "1.0.0",
  "cases": [
    {
      "case_id": "case-001-a",
      "kind": "vulnerable",
      "expectation_id": "expectation-001",
      "outcome": "missed",
      "execution_status": "success",
      "selected_finding_id": null,
      "evidence_match": null,
      "criteria": null,
      "distinct_findings": 0,
      "duplicate_findings": 0,
      "unrelated_findings": 0
    },
    {
      "case_id": "case-001-b",
      "kind": "safe_control",
      "expectation_id": null,
      "outcome": "safe_control_clean",
      "execution_status": "success",
      "selected_finding_id": null,
      "evidence_match": null,
      "criteria": null,
      "distinct_findings": 0,
      "duplicate_findings": 0,
      "unrelated_findings": 0
    },
    {
      "case_id": "case-002-a",
      "kind": "vulnerable",
      "expectation_id": "expectation-002",
      "outcome": "missed",
      "execution_status": "success",
      "selected_finding_id": null,
      "evidence_match": null,
      "criteria": null,
      "distinct_findings": 0,
      "duplicate_findings": 0,
      "unrelated_findings": 0
    },
    {
      "case_id": "case-002-b",
      "kind": "safe_control",
      "expectation_id": null,
      "outcome": "safe_control_clean",
      "execution_status": "success",
      "selected_finding_id": null,
      "evidence_match": null,
      "criteria": null,
      "distinct_findings": 0,
      "duplicate_findings": 0,
      "unrelated_findings": 0
    },
    {
      "case_id": "case-003-a",
      "kind": "vulnerable",
      "expectation_id": "expectation-003",
      "outcome": "missed",
      "execution_status": "success",
      "selected_finding_id": null,
      "evidence_match": null,
      "criteria": null,
      "distinct_findings": 0,
      "duplicate_findings": 0,
      "unrelated_findings": 0
    },
    {
      "case_id": "case-003-b",
      "kind": "safe_control",
      "expectation_id": null,
      "outcome": "safe_control_clean",
      "execution_status": "success",
      "selected_finding_id": null,
      "evidence_match": null,
      "criteria": null,
      "distinct_findings": 0,
      "duplicate_findings": 0,
      "unrelated_findings": 0
    },
    {
      "case_id": "case-004-a",
      "kind": "vulnerable",
      "expectation_id": "expectation-004",
      "outcome": "missed",
      "execution_status": "success",
      "selected_finding_id": null,
      "evidence_match": null,
      "criteria": null,
      "distinct_findings": 0,
      "duplicate_findings": 0,
      "unrelated_findings": 0
    },
    {
      "case_id": "case-004-b",
      "kind": "safe_control",
      "expectation_id": null,
      "outcome": "safe_control_clean",
      "execution_status": "success",
      "selected_finding_id": null,
      "evidence_match": null,
      "criteria": null,
      "distinct_findings": 0,
      "duplicate_findings": 0,
      "unrelated_findings": 0
    },
    {
      "case_id": "case-005-a",
      "kind": "vulnerable",
      "expectation_id": "expectation-005",
      "outcome": "missed",
      "execution_status": "success",
      "selected_finding_id": null,
      "evidence_match": null,
      "criteria": null,
      "distinct_findings": 0,
      "duplicate_findings": 0,
      "unrelated_findings": 0
    },
    {
      "case_id": "case-005-b",
      "kind": "safe_control",
      "expectation_id": null,
      "outcome": "safe_control_clean",
      "execution_status": "success",
      "selected_finding_id": null,
      "evidence_match": null,
      "criteria": null,
      "distinct_findings": 0,
      "duplicate_findings": 0,
      "unrelated_findings": 0
    },
    {
      "case_id": "case-006-a",
      "kind": "vulnerable",
      "expectation_id": "expectation-006",
      "outcome": "missed",
      "execution_status": "success",
      "selected_finding_id": null,
      "evidence_match": null,
      "criteria": null,
      "distinct_findings": 0,
      "duplicate_findings": 0,
      "unrelated_findings": 0
    },
    {
      "case_id": "case-006-b",
      "kind": "safe_control",
      "expectation_id": null,
      "outcome": "safe_control_clean",
      "execution_status": "success",
      "selected_finding_id": null,
      "evidence_match": null,
      "criteria": null,
      "distinct_findings": 0,
      "duplicate_findings": 0,
      "unrelated_findings": 0
    },
    {
      "case_id": "case-007-a",
      "kind": "vulnerable",
      "expectation_id": "expectation-007",
      "outcome": "missed",
      "execution_status": "success",
      "selected_finding_id": null,
      "evidence_match": null,
      "criteria": null,
      "distinct_findings": 0,
      "duplicate_findings": 0,
      "unrelated_findings": 0
    },
    {
      "case_id": "case-007-b",
      "kind": "safe_control",
      "expectation_id": null,
      "outcome": "safe_control_clean",
      "execution_status": "success",
      "selected_finding_id": null,
      "evidence_match": null,
      "criteria": null,
      "distinct_findings": 0,
      "duplicate_findings": 0,
      "unrelated_findings": 0
    },
    {
      "case_id": "case-008-a",
      "kind": "vulnerable",
      "expectation_id": "expectation-008",
      "outcome": "missed",
      "execution_status": "success",
      "selected_finding_id": null,
      "evidence_match": null,
      "criteria": null,
      "distinct_findings": 0,
      "duplicate_findings": 0,
      "unrelated_findings": 0
    },
    {
      "case_id": "case-008-b",
      "kind": "safe_control",
      "expectation_id": null,
      "outcome": "safe_control_clean",
      "execution_status": "success",
      "selected_finding_id": null,
      "evidence_match": null,
      "criteria": null,
      "distinct_findings": 0,
      "duplicate_findings": 0,
      "unrelated_findings": 0
    },
    {
      "case_id": "case-009-a",
      "kind": "vulnerable",
      "expectation_id": "expectation-009",
      "outcome": "missed",
      "execution_status": "success",
      "selected_finding_id": null,
      "evidence_match": null,
      "criteria": null,
      "distinct_findings": 0,
      "duplicate_findings": 0,
      "unrelated_findings": 0
    },
    {
      "case_id": "case-009-b",
      "kind": "safe_control",
      "expectation_id": null,
      "outcome": "safe_control_clean",
      "execution_status": "success",
      "selected_finding_id": null,
      "evidence_match": null,
      "criteria": null,
      "distinct_findings": 0,
      "duplicate_findings": 0,
      "unrelated_findings": 0
    },
    {
      "case_id": "case-010-a",
      "kind": "vulnerable",
      "expectation_id": "expectation-010",
      "outcome": "missed",
      "execution_status": "success",
      "selected_finding_id": null,
      "evidence_match": null,
      "criteria": null,
      "distinct_findings": 0,
      "duplicate_findings": 0,
      "unrelated_findings": 0
    },
    {
      "case_id": "case-010-b",
      "kind": "safe_control",
      "expectation_id": null,
      "outcome": "safe_control_clean",
      "execution_status": "success",
      "selected_finding_id": null,
      "evidence_match": null,
      "criteria": null,
      "distinct_findings": 0,
      "duplicate_findings": 0,
      "unrelated_findings": 0
    },
    {
      "case_id": "case-011-a",
      "kind": "vulnerable",
      "expectation_id": "expectation-011",
      "outcome": "missed",
      "execution_status": "success",
      "selected_finding_id": null,
      "evidence_match": null,
      "criteria": null,
      "distinct_findings": 0,
      "duplicate_findings": 0,
      "unrelated_findings": 0
    },
    {
      "case_id": "case-011-b",
      "kind": "safe_control",
      "expectation_id": null,
      "outcome": "safe_control_clean",
      "execution_status": "success",
      "selected_finding_id": null,
      "evidence_match": null,
      "criteria": null,
      "distinct_findings": 0,
      "duplicate_findings": 0,
      "unrelated_findings": 0
    },
    {
      "case_id": "case-012-a",
      "kind": "vulnerable",
      "expectation_id": "expectation-012",
      "outcome": "missed",
      "execution_status": "success",
      "selected_finding_id": null,
      "evidence_match": null,
      "criteria": null,
      "distinct_findings": 0,
      "duplicate_findings": 0,
      "unrelated_findings": 0
    },
    {
      "case_id": "case-012-b",
      "kind": "safe_control",
      "expectation_id": null,
      "outcome": "safe_control_clean",
      "execution_status": "success",
      "selected_finding_id": null,
      "evidence_match": null,
      "criteria": null,
      "distinct_findings": 0,
      "duplicate_findings": 0,
      "unrelated_findings": 0
    },
    {
      "case_id": "case-013-a",
      "kind": "vulnerable",
      "expectation_id": "expectation-013",
      "outcome": "missed",
      "execution_status": "success",
      "selected_finding_id": null,
      "evidence_match": null,
      "criteria": null,
      "distinct_findings": 0,
      "duplicate_findings": 0,
      "unrelated_findings": 0
    },
    {
      "case_id": "case-013-b",
      "kind": "safe_control",
      "expectation_id": null,
      "outcome": "safe_control_clean",
      "execution_status": "success",
      "selected_finding_id": null,
      "evidence_match": null,
      "criteria": null,
      "distinct_findings": 0,
      "duplicate_findings": 0,
      "unrelated_findings": 0
    },
    {
      "case_id": "case-014-a",
      "kind": "vulnerable",
      "expectation_id": "expectation-014",
      "outcome": "missed",
      "execution_status": "success",
      "selected_finding_id": null,
      "evidence_match": null,
      "criteria": null,
      "distinct_findings": 0,
      "duplicate_findings": 0,
      "unrelated_findings": 0
    },
    {
      "case_id": "case-014-b",
      "kind": "safe_control",